<?xml version="1.0" encoding="UTF-8"?>
<tag-mapping xmlns:xsi="http://www.w3.org/2001/XMLSchema-instance" default-zoom-appear="14"
             profile-name="default-profile" xmlns="http://mapsforge.org/tag-mapping"
             xsi:schemaLocation="http://mapsforge.org/tag-mapping https://raw.githubusercontent.com/mapsforge/mapsforge/master/resources/tag-mapping.xsd">
	
	<!-- ************* POIS *************** -->

	<!-- NATURAL EARTH OVERVIEW MAP TAGS -->
	<pois>

		<osm-tag key="ne_min_zoom" value="0" zoom-appear="0" >
		<osm-tag key="ne_min_zoom" value="1" zoom-appear="1" />
		<osm-tag key="ne_min_zoom" value="2" zoom-appear="2" />
		<osm-tag key="ne_min_zoom" value="3" zoom-appear="3" />
		<osm-tag key="ne_min_zoom" value="4" zoom-appear="4" />
		<osm-tag key="ne_min_zoom" value="5" zoom-appear="5" />
		<osm-tag key="ne_min_zoom" value="6" zoom-appear="6" />
		<osm-tag key="ne_min_zoom" value="7" zoom-appear="7" />
		<osm-tag key="ne_min_zoom" value="8" zoom-appear="8" />
		<osm-tag key="ne_min_zoom" value="9" zoom-appear="9" />

		<osm-tag key="ne_max_zoom" value="0" zoom-disappear="0" />
		<osm-tag key="ne_max_zoom" value="1" zoom-disappear="1" />
		<osm-tag key="ne_max_zoom" value="2" zoom-disappear="2" />
		<osm-tag key="ne_max_zoom" value="3" zoom-disappear="3" />
		<osm-tag key="ne_max_zoom" value="4" zoom-disappear="4" />
		<osm-tag key="ne_max_zoom" value="5" zoom-disappear="5" />
		<osm-tag key="ne_max_zoom" value="6" zoom-disappear="6" />
		<osm-tag key="ne_max_zoom" value="7" zoom-disappear="7" />
		<osm-tag key="ne_max_zoom" value="8" zoom-disappear="8" />
		<osm-tag key="ne_max_zoom" value="9" zoom-disappear="9" />

		<osm-tag key="ne_place" value="country" zoom-appear="0" />
		<osm-tag key="ne_place" value="city" zoom-appear="5" />
		<osm-tag key="ne_place" value="town" zoom-appear="5"/>
		<osm-tag key="ne_place" value="village" zoom-appear="7"/>
	</pois>
	<!-- HIGHWAY TAGS -->
	<pois>
		<osm-tag key="highway" value="bus_stop" zoom-appear="15" />
		<osm-tag key="highway" value="mini_roundabout" zoom-appear="16" />
		<osm-tag key="highway" value="motorway_junction" zoom-appear="10" />
		<osm-tag key="highway" value="traffic_signals" zoom-appear="17" />
		<osm-tag key="highway" value="trailhead" zoom-appear="13" />
		<osm-tag key="highway" value="turning_circle" zoom-appear="15" />
		
		<osm-tag key="car" value="yes" renderable="false" />
		<osm-tag key="cycleway" value="track" zoom-appear="14" />
		<osm-tag key="embankment" value="yes" zoom-appear="14" />
		<osm-tag key="ice_road" value="yes" zoom-appear="13" />
		<osm-tag key="motor_vehicle" value="no" zoom-appear="15" />
		<osm-tag key="truck" value="yes" renderable="false" />
	</pois>

	<!-- PUBLIC AMENITIES -->
	<pois>
		<osm-tag key="amenity" value="atm" zoom-appear="17" />
		<osm-tag key="amenity" value="bar" zoom-appear="15" />
		<osm-tag key="amenity" value="bbq" zoom-appear="15" />
		<osm-tag key="amenity" value="bicycle_parking" zoom-appear="15" />
		<osm-tag key="amenity" value="bench" zoom-appear="17" />
		<osm-tag key="amenity" value="bicycle_rental" zoom-appear="16" />
		<osm-tag key="amenity" value="bus_station" zoom-appear="15" />
		<osm-tag key="amenity" value="cafe" zoom-appear="16" />
		<osm-tag key="amenity" value="charging_station" zoom-appear="13" />
		<osm-tag key="amenity" value="cinema" zoom-appear="17" />
		<osm-tag key="amenity" value="college" zoom-appear="13" />
		<osm-tag key="amenity" value="drinking_water" zoom-appear="17" />
		<osm-tag key="amenity" value="fast_food" zoom-appear="17" />
		<osm-tag key="amenity" value="fire_station" zoom-appear="17" />
		<osm-tag key="amenity" value="fountain" zoom-appear="17" />
		<osm-tag key="amenity" value="fuel" zoom-appear="12" />
		<osm-tag key="amenity" value="grave_yard" zoom-appear="14" />
		<osm-tag key="amenity" value="hospital" zoom-appear="14" />
		<osm-tag key="amenity" value="hunting_stand" zoom-appear="15" />
		<osm-tag key="amenity" value="kindergarten" zoom-appear="17" />
		<osm-tag key="amenity" value="library" zoom-appear="17" />
		<osm-tag key="amenity" value="parking" zoom-appear="14" />
		<osm-tag key="amenity" value="pharmacy" zoom-appear="15" />
		<osm-tag key="amenity" value="place_of_worship" zoom-appear="13" />
		<osm-tag key="amenity" value="police" zoom-appear="15" />
		<osm-tag key="amenity" value="post_box" zoom-appear="17" />
		<osm-tag key="amenity" value="post_office" zoom-appear="17" />
		<osm-tag key="amenity" value="pub" zoom-appear="16" />
		<osm-tag key="amenity" value="public_bath" zoom-appear="14" />
		<osm-tag key="amenity" value="recycling" zoom-appear="17" />
		<osm-tag key="amenity" value="restaurant" zoom-appear="15" />
		<osm-tag key="amenity" value="school" zoom-appear="15" />
		<osm-tag key="amenity" value="shelter" zoom-appear="14" />
		<osm-tag key="amenity" value="telephone" zoom-appear="17" />
		<osm-tag key="amenity" value="theatre" zoom-appear="16" />
		<osm-tag key="amenity" value="toilets" zoom-appear="16" />
		<osm-tag key="amenity" value="university" zoom-appear="17" />
		<osm-tag key="amenity" value="vending_machine" zoom-appear="16" />
		
		<osm-tag key="aerialway" value="cable_car" zoom-appear="12" />
		<osm-tag key="aerialway" value="chair_lift" zoom-appear="12" />
		<osm-tag key="aerialway" value="drag_lift" zoom-appear="12" />
		<osm-tag key="aerialway" value="gondola" zoom-appear="12" />
		<osm-tag key="aerialway" value="goods" zoom-appear="12" />
		<osm-tag key="aerialway" value="j-bar" zoom-appear="12" />
		<osm-tag key="aerialway" value="magic_carpet" zoom-appear="12" />
		<osm-tag key="aerialway" value="mixed_lift" zoom-appear="12" />
		<osm-tag key="aerialway" value="platter" zoom-appear="12" />
		<osm-tag key="aerialway" value="rope_tow" zoom-appear="12" />
		<osm-tag key="aerialway" value="t-bar" zoom-appear="12" />
		
		<osm-tag key="bicycle" value="designated" renderable="false" />
		<osm-tag key="bicycle" value="yes" renderable="false" />
	
		<osm-tag key="emergency" value="phone" zoom-appear="16" />
		
		<osm-tag key="leisure" value="common" zoom-appear="14" />
		<osm-tag key="leisure" value="dog_park" zoom-appear="14" />
		<osm-tag key="leisure" value="fitness_station" zoom-appear="14" />
		<osm-tag key="leisure" value="firepit" zoom-appear="15" />
		<osm-tag key="leisure" value="golf_course" zoom-appear="14" />
		<osm-tag key="leisure" value="marina" zoom-appear="14" />
		<osm-tag key="leisure" value="nature_reserve" zoom-appear="14" />
		<osm-tag key="leisure" value="park" zoom-appear="14" />
		<osm-tag key="leisure" value="pitch" zoom-appear="14" />
		<osm-tag key="leisure" value="playground" zoom-appear="14" />
		<osm-tag key="leisure" value="slipway" zoom-appear="17" />
		<osm-tag key="leisure" value="sports_centre" zoom-appear="14" />
		<osm-tag key="leisure" value="stadium" zoom-appear="14" />
		<osm-tag key="leisure" value="swimming_area" zoom-appear="14" />
		<osm-tag key="leisure" value="swimming_pool" zoom-appear="14" />
		<osm-tag key="leisure" value="track" zoom-appear="14" />
		<osm-tag key="leisure" value="water_park" zoom-appear="14" />

		<osm-tag key="sport" value="bmx" zoom-appear="14" renderable="false"/>
		<osm-tag key="sport" value="climbing" zoom-appear="14" />
		<osm-tag key="sport" value="golf" zoom-appear="14" />
		<osm-tag key="sport" value="shooting" zoom-appear="14" />
		<osm-tag key="sport" value="soccer" zoom-appear="14" />
		<osm-tag key="sport" value="swimming" zoom-appear="14" />
		<osm-tag key="sport" value="tennis" zoom-appear="14" />		
	
		<osm-tag key="religion" value="buddhist" renderable="false" />		
		<osm-tag key="religion" value="christian" renderable="false" />
		<osm-tag key="religion" value="jewish" renderable="false" />
		<osm-tag key="religion" value="muslim" renderable="false" />
		
		<osm-tag key="building" value="barn" renderable="false" />
		<osm-tag key="building" value="chapel" renderable="false" />
		<osm-tag key="building" value="church" renderable="false" />
		
		<osm-tag key="shop" value="bakery" zoom-appear="17" />
		<osm-tag key="shop" value="bicycle" zoom-appear="17" />
		<osm-tag key="shop" value="convenience" zoom-appear="17" />
		<osm-tag key="shop" value="hairdresser" zoom-appear="17" />
		<osm-tag key="shop" value="organic" zoom-appear="17" />
		<osm-tag key="shop" value="supermarket" zoom-appear="16" />
		
		<osm-tag key="vending" value="bicycle_tube" zoom-appear="16" />
		<osm-tag key="vending" value="excrement_bags" zoom-appear="16" />
		<osm-tag key="vending" value="fuel" zoom-appear="16" />
		<osm-tag key="vending" value="parking_tickets" zoom-appear="16" />

		<osm-tag key="wheelchair" value="designated" zoom-appear="14" />
		<osm-tag key="wheelchair" value="yes" zoom-appear="14" />		
	</pois>

	<!-- PUBLIC TRANSPORT TAGS -->
	<pois>
		<osm-tag key="railway" value="halt" zoom-appear="15" />
		<osm-tag key="railway" value="level_crossing" zoom-appear="16" />
		<osm-tag key="railway" value="preserved" zoom-appear="12" />
		<osm-tag key="railway" value="rail" zoom-appear="10" />
		<osm-tag key="railway" value="station" zoom-appear="13" />
		<osm-tag key="railway" value="subway" zoom-appear="13" />
		<osm-tag key="railway" value="subway_entrance" zoom-appear="15" />	
		<osm-tag key="railway" value="tram_stop" zoom-appear="15" />
		<osm-tag key="railway" value="turntable" zoom-appear="13" />
		
		<osm-tag key="station" value="light_rail" zoom-appear="14" />
		<osm-tag key="station" value="subway" zoom-appear="14" />		
	</pois>

	<!-- TOURISM TAGS -->
	<pois>
		<osm-tag key="tourism" value="alpine_hut" zoom-appear="13" />
		<osm-tag key="tourism" value="apartment" zoom-appear="14" />
		<osm-tag key="tourism" value="attraction" zoom-appear="14" />
		<osm-tag key="tourism" value="camp_site" zoom-appear="14" />
		<osm-tag key="tourism" value="caravan_site" zoom-appear="14" />
		<osm-tag key="tourism" value="guest_house" zoom-appear="14" />
		<osm-tag key="tourism" value="hostel" zoom-appear="14" />